{
  "name": "Portfolio",
  "image": {
    "url": "/src/assets/images/projects/portfolio astro.png",
    "alt": "Portfolio project homepage"
  },
  "startDate": "2024-06-30T18:30:00.000Z",
  "endDate": "2024-07-14T18:30:00.000Z",
  "description": [
    "It contains all my projects, experiences.",
    "List of blogs about various topics."
  ],
  "skills": [
    "Astro",
    "Tailwind CSS",
    "Tina CMS"
  ],
  "liveUrl": "https://wasimraja.netlify.app",
  "githubUrl": "https://github.com/wasim7raja10/portfolio"
}